{
  "version": 1,
  "command": "refactor-rename",
  "ok": true,
  "target_id": "binding:fn:main::apply:1:bonus@25",
  "old_name": "bonus",
  "new_name": "extra",
  "edits": [
    {
      "module": "main",
      "path": "tests/fixtures/supervised_workflow/after/main.nq",
      "span": {
        "start": 25,
        "end": 30
      },
      "old_text": "bonus",
      "replacement": "extra",
      "kind": "definition",
      "target_id": "binding:fn:main::apply:1:bonus@25"
    },
    {
      "module": "main",
      "path": "tests/fixtures/supervised_workflow/after/main.nq",
      "span": {
        "start": 143,
        "end": 148
      },
      "old_text": "bonus",
      "replacement": "extra",
      "kind": "reference",
      "target_id": "binding:fn:main::apply:1:bonus@25"
    },
    {
      "module": "main",
      "path": "tests/fixtures/supervised_workflow/after/main.nq",
      "span": {
        "start": 308,
        "end": 313
      },
      "old_text": "bonus",
      "replacement": "extra",
      "kind": "reference",
      "target_id": "binding:fn:main::apply:1:bonus@25"
    }
  ],
  "diagnostics": []
}
