{
  "version": 1,
  "command": "refactor-rename",
  "ok": true,
  "target_id": "variant:helper::Choice::Use",
  "old_name": "Use",
  "new_name": "Keep",
  "edits": [
    {
      "module": "helper",
      "path": "tests/fixtures/evidence_parity/after/helper.nq",
      "span": {
        "start": 104,
        "end": 107
      },
      "old_text": "Use",
      "replacement": "Keep",
      "kind": "definition",
      "target_id": "variant:helper::Choice::Use"
    },
    {
      "module": "main",
      "path": "tests/fixtures/evidence_parity/after/main.nq",
      "span": {
        "start": 947,
        "end": 950
      },
      "old_text": "Use",
      "replacement": "Keep",
      "kind": "reference",
      "target_id": "variant:helper::Choice::Use"
    },
    {
      "module": "main",
      "path": "tests/fixtures/evidence_parity/after/main.nq",
      "span": {
        "start": 1017,
        "end": 1020
      },
      "old_text": "Use",
      "replacement": "Keep",
      "kind": "reference",
      "target_id": "variant:helper::Choice::Use"
    }
  ],
  "diagnostics": []
}
