{
  "version": 1,
  "command": "refactor-rename",
  "ok": true,
  "target_id": "const:helper::base_score",
  "old_name": "base_score",
  "new_name": "starting_score",
  "edits": [
    {
      "module": "helper",
      "path": "tests/fixtures/evidence_parity/after/helper.nq",
      "span": {
        "start": 10,
        "end": 20
      },
      "old_text": "base_score",
      "replacement": "starting_score",
      "kind": "definition",
      "target_id": "const:helper::base_score"
    },
    {
      "module": "main",
      "path": "tests/fixtures/evidence_parity/after/main.nq",
      "span": {
        "start": 345,
        "end": 355
      },
      "old_text": "base_score",
      "replacement": "starting_score",
      "kind": "reference",
      "target_id": "const:helper::base_score"
    }
  ],
  "diagnostics": []
}
