{
  "version": 1,
  "command": "refactor-rename",
  "ok": true,
  "target_id": "field:helper::Box::value",
  "old_name": "value",
  "new_name": "amount",
  "edits": [
    {
      "module": "helper",
      "path": "tests/fixtures/evidence_parity/after/helper.nq",
      "span": {
        "start": 51,
        "end": 56
      },
      "old_text": "value",
      "replacement": "amount",
      "kind": "definition",
      "target_id": "field:helper::Box::value"
    },
    {
      "module": "main",
      "path": "tests/fixtures/evidence_parity/after/main.nq",
      "span": {
        "start": 959,
        "end": 964
      },
      "old_text": "value",
      "replacement": "amount",
      "kind": "reference",
      "target_id": "field:helper::Box::value"
    },
    {
      "module": "main",
      "path": "tests/fixtures/evidence_parity/after/main.nq",
      "span": {
        "start": 800,
        "end": 805
      },
      "old_text": "value",
      "replacement": "amount",
      "kind": "reference",
      "target_id": "field:helper::Box::value"
    },
    {
      "module": "main",
      "path": "tests/fixtures/evidence_parity/after/main.nq",
      "span": {
        "start": 897,
        "end": 902
      },
      "old_text": "value",
      "replacement": "amount",
      "kind": "reference",
      "target_id": "field:helper::Box::value"
    }
  ],
  "diagnostics": []
}
